{
    "$schema": "http://json-schema.org/draft-07/schema#",
    "title": "CP2077 Mod Map Registry",
    "type": "array",
    "items": {
        "type": "object",
        "required": [
            "id",
            "name",
            "authors",
            "coordinates",
            "nexus_id",
            "description",
            "category",
            "tags"
        ],
        "properties": {
            "id": {
                "type": "string",
                "description": "Server-generated, never set by a submitter. A UUID v4, or 'nexus-<modId>' for the nine records imported from auto-discovery before the cutover. The legacy form is a closed set: nothing mints a new one.",
                "pattern": "^([0-9a-f]{8}-[0-9a-f]{4}-4[0-9a-f]{3}-[89ab][0-9a-f]{3}-[0-9a-f]{12}|nexus-\\d+)$"
            },
            "name": {
                "type": "string",
                "minLength": 3
            },
            "authors": {
                "type": "array",
                "items": {
                    "type": "string"
                },
                "minItems": 1
            },
            "credits": {
                "type": "string",
                "description": "Additional credits for teams or contributors without specific Nexus profiles"
            },
            "coordinates": {
                "type": "array",
                "items": {
                    "type": "number"
                },
                "minItems": 2,
                "maxItems": 3,
                "description": "[X, Y, Z] — in-game coordinates from Cyber Engine Tweaks (X = east/west, Y = north/south, Z = height/elevation). Z is required for new submissions; existing entries with only [X, Y] remain valid."
            },
            "yaw": {
                "type": "number",
                "description": "Optional. Player facing direction in degrees from CET output (extracted from GetWorldOrientation():ToEulerAngles().yaw)."
            },
            "nexus_id": {
                "type": "string",
                "pattern": "^(\\d+|WIP|Dummy)$",
                "description": "The Nexus Mods ID (number), or 'WIP' / 'Dummy' for unpublished content"
            },
            "description": {
                "type": "string",
                "maxLength": 500
            },
            "category": {
                "type": "string",
                "enum": [
                    "location-overhaul",
                    "new-location",
                    "other"
                ],
                "description": "Category of the mod: location-overhaul, new-location, or other"
            },
            "tags": {
                "type": "array",
                "items": {
                    "type": "string"
                },
                "description": "Tags for filtering and additional info (styles, lifepaths, etc.)"
            }
        }
    }
}