{
    "id": "e279053f-c77c-4f7f-a9dc-badb1216a262",
    "name": "Arroyo Safehouse",
    "authors": [
        "skrittleskittie"
    ],
    "credits": "",
    "coordinates": [
        -685.7589,
        -914.7684,
        8.0033
    ],
    "nexus_id": "28736",
    "description": "An unassuming safehouse right in the middle of Arroyo, right past Red Dirt bar. Need to be purchased first on the terminal right by the front door",
    "category": "new-location",
    "tags": [
        "house"
    ],
    "yaw": -126.2372
}
