{
    "id": "491fbb93-7e93-4e64-ad32-e756d46573d5",
    "name": "Japantown Apartment Balcony",
    "authors": [
        "hnovak1"
    ],
    "credits": "",
    "coordinates": [
        -784.7092,
        978.3455,
        28.2095
    ],
    "nexus_id": "29466",
    "description": "The same balcony as in my Rockerdoll Japantown Apartment mod, but without changing any other part of the apartmen",
    "category": "location-overhaul",
    "tags": [
        "apartment"
    ],
    "yaw": 94.3499
}
