{
    "id": "8b91dc3e-fe20-4eb4-90d7-9bea48bd1376",
    "name": "Grey rd House - Santo Domingo",
    "authors": [
        "DevilDevil868"
    ],
    "credits": "",
    "coordinates": [
        141.5926,
        -2118.6399,
        16.6663
    ],
    "nexus_id": "30699",
    "description": "A new home for V in Santo Domingo.",
    "category": "new-location",
    "tags": [
        "apartment",
        "house"
    ],
    "yaw": 23.78
}
