{
    "id": "7f505943-25dc-4747-a813-177568e9610d",
    "name": "Church From Hell - Devils Luck",
    "authors": [
        "TheRealJonCross"
    ],
    "credits": "",
    "coordinates": [
        -3458.1965,
        -4038.4612,
        74.8636
    ],
    "nexus_id": "29542",
    "description": "Fully Decorated Church Interior, Lit Up and with Custom Teleport Interactions Traveling To and From The Church for Repeated Communal Confessions",
    "category": "new-location",
    "tags": [
        "entertainment"
    ],
    "yaw": 42.4
}
