{
    "id": "ee8fc5c6-089f-49fb-a881-dd9050da9950",
    "name": "Pacifica Hotel Pistis Sophia Apartment",
    "authors": [
        "hnovak1"
    ],
    "credits": "",
    "coordinates": [
        -2630.1057,
        -2450.5002,
        35.0366
    ],
    "nexus_id": "31015",
    "description": "The same floor where Johnny takes V after the Dashi Parade, but different apartment, with great view to the Pacifica Pier.",
    "category": "location-overhaul",
    "tags": [
        "apartment",
        "quest"
    ],
    "yaw": -145.7413
}
