{
    "id": "09b3b7c1-1ab2-49ed-9649-c5fc6db83158",
    "name": "Corpo Plaza Rooftop Hideout",
    "authors": [
        "hnovak1"
    ],
    "credits": "",
    "coordinates": [
        -1621.7606,
        -45.0897,
        97.3348
    ],
    "nexus_id": "30665",
    "description": "A small but cozy and free place for V in the heart of Corpo Plaza",
    "category": "new-location",
    "tags": [
        "apartment",
        "corpo"
    ],
    "yaw": 27.9975
}
