{
    "id": "e4d9d20a-2d8c-4ba1-812c-e53dff5122b7",
    "name": "Hanami - japantown (japanese restaurant)",
    "authors": [
        "thumbsuckerr"
    ],
    "credits": "",
    "coordinates": [
        -881.6379,
        792.1102,
        23.3377
    ],
    "nexus_id": "30272",
    "description": "japanese restaurant in japantown",
    "category": "new-location",
    "tags": [
        "corpo",
        "entertainment"
    ],
    "yaw": 110.0701
}
